original_index,label,text,sentiment,n_1st_verb,n_1st_pronoun,n_sing,n_past,n_cond,n_words,rate_verb,rate_pron,rate_sing,rate_past,rate_cond,emoji,absolutist
5405,0,"Mam tak samo z neutral beauty, moja pierwsza konturówka i pomadka, której używam do dziś bo jeszcze resztki pomadek mi zostały, ale konturówki już z nami nie ma [*] fly high lovely k lips:dove:",1,2.0,3.0,2.0,0.0,0.0,33.0,0.0606060606060606,0.0909090909090909,1.0,0.0,0.0,1,1
5620,0,ja po prostu już umiem czytać mózg gabi,-1,1.0,1.0,1.0,0.0,0.0,8.0,0.125,0.125,1.0,0.0,0.0,0,0
3006,0,Remontada,0,0.0,0.0,0.0,0.0,0.0,1.0,0.0,0.0,0.0,0.0,0.0,0,0
304,1,trauma,0,0.0,0.0,0.0,0.0,0.0,1.0,0.0,0.0,0.0,0.0,0.0,0,0
2738,0,"Oho :eyes:

Jesteśmy w unikalnym momencie na rynku, wykorzystajmy to.

Jest coś jeszcze co chcielibyście usłyszeć u mnie i ?",1,1.0,1.0,0.0,0.0,0.0,19.0,0.0526315789473684,0.0526315789473684,0.0,0.0,0.0,1,0
1253,1,a oddasz mi moja dziewczyne ? Thanks from mountain,1,0.0,2.0,0.0,0.0,0.0,8.0,0.0,0.25,0.0,0.0,0.0,0,0
4749,0,chb zbalazlam miejsce na robienie inzynierki slash magisterki slash doktoratu yaaaaaaaa,0,0.0,0.0,0.0,0.0,0.0,11.0,0.0,0.0,0.0,0.0,0.0,0,0
503,1,Pierwsze w tym roku!!!:flexed_biceps:,1,0.0,0.0,0.0,0.0,0.0,4.0,0.0,0.0,0.0,0.0,0.0,1,0
4218,0,Te albumy już mi az tak nie siadają,-1,0.0,1.0,0.0,0.0,0.0,8.0,0.0,0.125,0.0,0.0,0.0,0,0
462,1,Aleja Minecraft,1,0.0,0.0,0.0,0.0,0.0,2.0,0.0,0.0,0.0,0.0,0.0,0,0
864,1,Ja tu widzę kutasa,-1,1.0,1.0,1.0,0.0,0.0,4.0,0.25,0.25,1.0,0.0,0.0,0,0
4524,0,Szczerze myślałam że ja tak mam jak tylko wracam do domu i widzę te same miejsce czyli nudne miejsce gdzie rodzice uznali że tu nas dom…. Ile razy mam ochotę z tego uciec i być gdzieś indziej …,-1,5.0,2.0,5.0,1.0,0.0,37.0,0.1351351351351351,0.054054054054054,1.0,0.2,0.0,0,0
890,1,Ale to bolało serio... Nie spodziewałam się tak szybkiej śmierci kogokolwiek....,-1,1.0,0.0,1.0,1.0,0.0,11.0,0.0909090909090909,0.0,1.0,1.0,0.0,0,0
5005,0,ponawiam jak bede sie przenosic to kto chcialby user:head_shaking_vertically:,0,2.0,0.0,2.0,0.0,0.0,9.0,0.2222222222222222,0.0,1.0,0.0,0.0,1,0
1210,1,NIE WSZYSCY SA PAN JEONKIE NIE WSZYSCY SA PAN,-1,0.0,0.0,0.0,0.0,0.0,9.0,0.0,0.0,0.0,0.0,0.0,0,0
5642,0,jebac cie cwelon nie zaslaniaj mnie cieniem,-1,0.0,1.0,0.0,0.0,0.0,7.0,0.0,0.1428571428571428,0.0,0.0,0.0,0,0
1520,1,na grzale sol nikotynowa z vbara smak grape ice,0,0.0,0.0,0.0,0.0,0.0,9.0,0.0,0.0,0.0,0.0,0.0,0,0
5563,0,"Jak to tam leciało? Justin się wypalił i zrobił słabe show??? 
Dosłownie liczby wam pokazują jaką moc ma jego osoba a wy nadal tego nie rozumiecie",-1,0.0,0.0,0.0,0.0,0.0,26.0,0.0,0.0,0.0,0.0,0.0,0,0
5061,0,"Tak jak współczuje wszystkim, którzy stracili pieniądze w wyniku oszustwa, to ja pie*dolę, nie mogę po prostu wyjść z podziwu głupoty jaką jest trzymanie takich pieniędzy w:

1) Kryptowalutach (których się nie rozumie)
2) Na giełdzie, która jest de facto nieregulowaną firmą bez żadnej gwarancji wypłaty środków

Ludzie boją się trzymać pieniądze w bankach (mimo, że tam mają gwarancję do 100k euro), ale paręset tysięcy w prywatnej firmie bez żadnego nadzoru i gwarancji? Luz.

I to po tych wszystkich historiach giełd, które pobankrutowały i ludzie potracili w nich miliardy...

Nie wiem po prostu co się musi wydarzyć, żeby ludzie przestali zachowywać się jak debile.

P.S. Jeśli już chcesz trzymać pieniądze w kryptowalutach, to trzymaj je na swoim prywatnym portfelu, do którego dostęp masz tylko ty, a hasło masz zapisane w bezpiecznym miejscu, poza jakimkolwiek komputerem.

Screeny od ",-1,2.0,1.0,2.0,0.0,0.0,138.0,0.0144927536231884,0.0072463768115942,1.0,0.0,0.0,0,1
5659,0,MONGOLIAAA,1,0.0,0.0,0.0,0.0,0.0,1.0,0.0,0.0,0.0,0.0,0.0,0,0
2485,0,Ideał Tuska  i pedofilów z platformy,0,0.0,0.0,0.0,0.0,0.0,6.0,0.0,0.0,0.0,0.0,0.0,0,0
39,1,"cwel zgłosił mój cytat do tego więc napiszę jeszcze raz:
jeśli napastujesz mnie w internecie razem z tą szkaradą jebany klaunie to zrób krok do przodu 

chciałbym tu tylko zostawić poziom moich rozmówców i żebyście nie wstawiali swoich brzydkich mord jeśli kogoś wyzywacie",-1,2.0,3.0,2.0,0.0,1.0,43.0,0.0465116279069767,0.0697674418604651,1.0,0.0,0.5,0,0
4382,0,He isn't even 10% goodlooking as he thinks,1,0.0,0.0,0.0,0.0,0.0,8.0,0.0,0.0,0.0,0.0,0.0,0,0
2410,0,"Patataj, patataj…",-1,0.0,0.0,0.0,0.0,0.0,2.0,0.0,0.0,0.0,0.0,0.0,0,0
4511,0,"16
24",0,0.0,0.0,0.0,0.0,0.0,2.0,0.0,0.0,0.0,0.0,0.0,0,0
3433,0,wiem za to cię lubię,1,2.0,0.0,2.0,0.0,0.0,5.0,0.4,0.0,1.0,0.0,0.0,0,0
5042,0,"Nie wiem co to jest. Wiem tylko, że vlogi kręci na swoim yt. Ale brakuje mi Piątek the series:grinning_squinting_face:",0,2.0,1.0,2.0,0.0,0.0,19.0,0.1052631578947368,0.0526315789473684,1.0,0.0,0.0,1,0
3822,0,Udało mi się nawet wkręcić Michała w nagranie TikToka XD,1,0.0,1.0,0.0,0.0,0.0,10.0,0.0,0.1,0.0,0.0,0.0,1,0
1905,1,Nie lubie,-1,1.0,0.0,1.0,0.0,0.0,2.0,0.5,0.0,1.0,0.0,0.0,0,0
4870,0,"jestem tak zmęczona, wzięłam rano przeciwbólowe na głowę i dalej poszłam spać",-1,3.0,0.0,3.0,2.0,0.0,12.0,0.25,0.0,1.0,0.6666666666666666,0.0,0,0
5444,0,nie znasz życia nie igraj z losem,0,0.0,0.0,0.0,0.0,0.0,7.0,0.0,0.0,0.0,0.0,0.0,0,0
5155,0,benger najlepsza nuta z tej ep,1,0.0,0.0,0.0,0.0,0.0,6.0,0.0,0.0,0.0,0.0,0.0,0,0
1598,1,"pamiętniki wampirów, the 100 i dom z papieru",0,0.0,0.0,0.0,0.0,0.0,8.0,0.0,0.0,0.0,0.0,0.0,0,0
3424,0,Co z tego zrozumie pomarańczowa głowa?,0,0.0,0.0,0.0,0.0,0.0,6.0,0.0,0.0,0.0,0.0,0.0,0,0
4607,0,Because why wait? For what?,1,0.0,0.0,0.0,0.0,0.0,5.0,0.0,0.0,0.0,0.0,0.0,0,0
5416,0,Zagłosowane :sparkles:,0,0.0,0.0,0.0,0.0,0.0,1.0,0.0,0.0,0.0,0.0,0.0,1,0
3428,0,Twoja chata? :slightly_smiling_face:,0,0.0,0.0,0.0,0.0,0.0,2.0,0.0,0.0,0.0,0.0,0.0,1,0
3838,0,lepiej mi z mysla ze wy tez jeszcze nic nie ogarnelyscie hehe :woman_in_lotus_position_light_skin_tone::woman_in_lotus_position_light_skin_tone::woman_in_lotus_position_light_skin_tone:,0,0.0,1.0,0.0,0.0,0.0,12.0,0.0,0.0833333333333333,0.0,0.0,0.0,1,1
4131,0,Bo z tym życiem lub nie wirusa to jest jak z pewnym kotem w pudełku. Jak mamy komputer to wiemy czy jest włączony czy nie. Wirus w tej analogi to program potrzebujący maszyny do uruchomienia. My się zastanawiamy czy jest włączony czy nie. Może nie trzeba i popełniamy bład?,-1,4.0,1.0,0.0,0.0,0.0,49.0,0.0816326530612244,0.0204081632653061,0.0,0.0,0.0,0,0
1070,1,"Bo myślałem, że o ten chodziło xd u mnie nawet takiego nie miałem. XD dowiedziałem się, że coś takiego jest jak miałem plastik w łapie :rolling_on_the_floor_laughing:",0,4.0,1.0,4.0,4.0,0.0,25.0,0.16,0.04,1.0,1.0,0.0,1,0
4,1,"Ja się dosłownie czuję jak taka dama czasami ale nie wiem czy to negatywnie czy pozytywnie, myślę że oba na raz:grinning_face_with_sweat:",0,3.0,1.0,3.0,0.0,0.0,21.0,0.1428571428571428,0.0476190476190476,1.0,0.0,0.0,1,0
96,1,"Dobra, jak to przekupne nieznające się geje by powiedzieli…let’s do this! 

Przesłuchałem wszystkich skrótów, i szkoda że dopuścili kryminalistów, bo poziom wydaje się być bardzo wysoki. Szczególnie porównując do marnego zeszłego roku. 

Teraz alfabetycznie słucham w całości 1/",-1,2.0,0.0,2.0,1.0,0.0,38.0,0.0526315789473684,0.0,1.0,0.5,0.0,0,0
2559,0,A Puławskiego?,-1,0.0,0.0,0.0,0.0,0.0,2.0,0.0,0.0,0.0,0.0,0.0,0,0
4278,0,Dzieki Stary!,1,0.0,0.0,0.0,0.0,0.0,2.0,0.0,0.0,0.0,0.0,0.0,0,0
628,1,"ja w odp u ciebie zobaczyłam nawet moją jedną moot z którą się obserwuję na ig i ona ci napisała, że pierdolisz xdd honey, widzę twoje zdjęcia na ig, i can tell from a mile away, że to android :skull::skull: to też był właśnie jeden z powód dla których kupiłam ip.",1,4.0,2.0,4.0,2.0,0.0,50.0,0.08,0.04,1.0,0.5,0.0,1,0
5145,0,OOOOOOOOOOOO MÓJ RAKOOOWIEEEEEEEE,-1,0.0,0.0,0.0,0.0,0.0,3.0,0.0,0.0,0.0,0.0,0.0,0,0
4203,0,cwel jebany z faweli już odklejki łapie xddd,0,0.0,0.0,0.0,0.0,0.0,8.0,0.0,0.0,0.0,0.0,0.0,0,0
971,1,"Przyjechał na czas, to trzeba go nauczyć",1,0.0,0.0,0.0,0.0,0.0,7.0,0.0,0.0,0.0,0.0,0.0,0,0
1566,1,robie reconnecting z natura i ide sie zjarac nad rzeczka z znajomymi :p,1,2.0,0.0,2.0,0.0,0.0,13.0,0.1538461538461538,0.0,1.0,0.0,0.0,1,0
4284,0,Idk o co chodzi ale ostatnio mam taki homesick :slightly_frowning_face::slightly_frowning_face:,1,1.0,0.0,1.0,0.0,0.0,9.0,0.1111111111111111,0.0,1.0,0.0,0.0,1,0
4346,0,"Kontekst ""na dziś"": Arsenal wczołgał się do półfinału Ligi Mistrzów. Gra wygląda fatalnie. Kryzys to mało powiedziane. Naprawdę ciężko się to ogląda.

Kontekst ""szeroki"": bardzo należy docenić fakt, że AFC gra rok do roku w półfinale Ligi Mistrzów. To jest ogromne.",0,0.0,0.0,0.0,0.0,0.0,41.0,0.0,0.0,0.0,0.0,0.0,0,0
5258,0,Usnęłam wczoraj i nie przesłuchałam albumu Zee:pensive_face:,-1,2.0,0.0,2.0,2.0,0.0,7.0,0.2857142857142857,0.0,1.0,1.0,0.0,1,0
706,1,Lowkey chce odwołać terapie i sir zaćpać ale tez chcr porozmawiac z terapeutą bo tego potrzrbujr zanim sid zaćpać,-1,0.0,0.0,0.0,0.0,0.0,19.0,0.0,0.0,0.0,0.0,0.0,0,0
4701,0,"Uwielbiam jak nic nie wstawiam na bookstagrama i rosną mi obserwujący, a jak już coś wrzucę to nagle spadają w dół XD",1,3.0,1.0,3.0,0.0,0.0,22.0,0.1363636363636363,0.0454545454545454,1.0,0.0,0.0,1,1
4392,0,he is just a chill guy,1,0.0,0.0,0.0,0.0,0.0,6.0,0.0,0.0,0.0,0.0,0.0,0,0
5217,0,k*rwa polaki sa niezdolne do napisania czegos co nie bylo powiadziane przez usta setki tysiecy innych bezbekow. ZDOBADZ OSOBOWOSC ALBO WLASNY ROZUM,-1,0.0,0.0,0.0,0.0,0.0,22.0,0.0,0.0,0.0,0.0,0.0,0,0
998,1,imagine ze idziesz na randke z dziewczyna i najbardziej obchodzi cie randomowy obcy czlowiek ktory w zaden sposob ci nie przeszkadza,1,0.0,0.0,0.0,0.0,0.0,21.0,0.0,0.0,0.0,0.0,0.0,0,0
5070,0,Wybór był oczywisty.,0,0.0,0.0,0.0,0.0,0.0,3.0,0.0,0.0,0.0,0.0,0.0,0,0
301,1,marze o jakimś jedzonku dobrym,1,1.0,0.0,1.0,0.0,0.0,5.0,0.2,0.0,1.0,0.0,0.0,0,0
214,1,"Pogrzebie zrobiłam i chciał się na usługę zapisać. Pyta o podanie mego pięknego zeszytu do Religii, wręczam  … zdziwko … i udawany brak zachwytu. Ale pyta mnie też o niedzielne kazanie. Patrzę jak na jakieś gotyckie pozamykane wrota… teraz myślę, że może ten nowy Ksiądz",-1,4.0,2.0,4.0,1.0,0.0,43.0,0.0930232558139534,0.0465116279069767,1.0,0.25,0.0,0,0
2650,0,"Nie wiem jak inaczej niż odklejeniem się nazwać sytuacje, w której ktoś hipotetycznie nazywa kogoś pedofilem. Karol nie posiada pornografii dziecięcej, nie molestuje, ani w inny sposób nie narusza niczyjej sfery cielesnej. Jeśli masz jakieś informacje, których ja nie posiadam to idź z tym na policję. Pedofilia to poważne wykroczenie, a nie wyzwisko.",-1,2.0,1.0,2.0,0.0,0.0,53.0,0.0377358490566037,0.0188679245283018,1.0,0.0,0.0,0,1
2293,0,"Nikt nie może pobierać od Was pieniędzy, jeżeli nie jesteście klubem piłkarskim i nie rezerwujecie boiska na daną godzinę.

Jeżeli boisko jest puste, to wchodzisz i grasz. Nawet, jak będzie Was 100 osób!",-1,0.0,0.0,0.0,0.0,0.0,33.0,0.0,0.0,0.0,0.0,0.0,0,0
5609,0,ZABIJCIE MNIE,-1,0.0,1.0,0.0,0.0,0.0,2.0,0.0,0.5,0.0,0.0,0.0,0,0
2934,0,"Nastolatki to zwierzęta, mijam to bydło idąc na siłownię, dra mordy a idź pan w chuj",-1,1.0,0.0,1.0,0.0,0.0,16.0,0.0625,0.0,1.0,0.0,0.0,0,0
621,1,"zastanawiam się czy nie wybrać się z bestie na maraton horrorów do heliosa, ale znowu tylko na pierwszy film bo to premiera mumii",1,1.0,0.0,1.0,0.0,0.0,23.0,0.0434782608695652,0.0,1.0,0.0,0.0,0,0
4944,0,GRATY,1,0.0,0.0,0.0,0.0,0.0,1.0,0.0,0.0,0.0,0.0,0.0,0,0
915,1,"Najgorsze jest to, że nie mam serca jej wygarnąć, bo laska jest sympatyczna, ale no kurwa ma 30 na karku, syfi jak skurwysyn i ciągle drzwiami napierdala",-1,1.0,0.0,1.0,0.0,0.0,27.0,0.037037037037037,0.0,1.0,0.0,0.0,0,1
3290,0,"Też bez przesady, że nic nie stworzyli...",0,0.0,0.0,0.0,0.0,0.0,7.0,0.0,0.0,0.0,0.0,0.0,0,1
376,1,Borderek borderkuje,1,0.0,0.0,0.0,0.0,0.0,2.0,0.0,0.0,0.0,0.0,0.0,0,0
5565,0,Czy możemy poświęcić chwilę żeby porozmawiac o tym jak bardzo jestem zła że nie zaśpiewał tej piosenki na Coachelli,0,2.0,0.0,1.0,0.0,0.0,19.0,0.1052631578947368,0.0,0.5,0.0,0.0,0,0
4576,0,"Kto jak kto ale kopciuszki to już chyba wszystkie się zameldowały w Polsce.
Tarabanią aż miło.

:speaker_high_volume::speaker_high_volume::speaker_high_volume::speaker_high_volume:",1,0.0,0.0,0.0,0.0,0.0,16.0,0.0,0.0,0.0,0.0,0.0,1,1
3360,0,"Wróciłem do treningów, nogą sprawowała się ok. Do tego osiągnąłem kamien milowy w pracy i w sumie chyba powoli serio nie mam tam czego szukać. Do osiągnięcia zostało już całe nic.",1,3.0,0.0,3.0,2.0,0.0,31.0,0.0967741935483871,0.0,1.0,0.6666666666666666,0.0,0,1
3016,0,Standard. Znaleźli godne zastępstwo dla Ramosa. Na szczęście Bayern uratował futbol.,1,0.0,0.0,0.0,0.0,0.0,11.0,0.0,0.0,0.0,0.0,0.0,0,0
1399,1,Jeszcze taką sukienkę,1,0.0,0.0,0.0,0.0,0.0,3.0,0.0,0.0,0.0,0.0,0.0,0,0
5509,0,Ja niby tez chyba a on sie wpierdala wszedzie te swoja cwelowska ikonke,0,0.0,1.0,0.0,0.0,0.0,13.0,0.0,0.0769230769230769,0.0,0.0,0.0,0,0
199,1,A nie! Kompleta…,1,0.0,0.0,0.0,0.0,0.0,3.0,0.0,0.0,0.0,0.0,0.0,0,0
1773,1,"Zajebista akcja, jak to jest, ze ja jestem dla wszystkich, a dla mnie nikogo nie ma",1,1.0,2.0,1.0,0.0,0.0,16.0,0.0625,0.125,1.0,0.0,0.0,0,0
2098,1,"A wiec mam lowkey zdiagnozowana depresje, do tego gleboka depresje",-1,1.0,0.0,1.0,0.0,0.0,10.0,0.1,0.0,1.0,0.0,0.0,0,0
1190,1,Olejcie babe atencjuszke tom glupiom rure i follow mozenowe kontoxddd,0,1.0,0.0,1.0,1.0,0.0,11.0,0.0909090909090909,0.0,1.0,1.0,0.0,0,0
4035,0,JA PIERDOLE,1,1.0,1.0,1.0,0.0,0.0,2.0,0.5,0.5,1.0,0.0,0.0,0,0
5492,0,Dzisjaj będą grane currency wars i er,0,0.0,0.0,0.0,0.0,0.0,7.0,0.0,0.0,0.0,0.0,0.0,0,0
943,1,“to jest centaur! pół koń pół koń” tak oczywiście pałka,1,0.0,0.0,0.0,0.0,0.0,10.0,0.0,0.0,0.0,0.0,0.0,0,0
686,1,PATKA WPISZ SOBIE SERIAL FROM I WSZYSTKO BEDZIE JASNE XDDD,1,0.0,0.0,0.0,0.0,0.0,10.0,0.0,0.0,0.0,0.0,0.0,1,0
3297,0,"Ty też chudniesz teraz, więc uważaj :eyes::grinning_face_with_sweat:",0,0.0,0.0,0.0,0.0,0.0,6.0,0.0,0.0,0.0,0.0,0.0,1,0
1805,1,"lost, from (niedokończone)",0,0.0,0.0,0.0,0.0,0.0,3.0,0.0,0.0,0.0,0.0,0.0,0,0
206,1,No. I ten Kapłan zmarł nagle. I mój dziadek wtedy też zmarł… dzień po dniu. I tak doczekaliśmy wiosny bodajże 2004 Roku Pańskiego. Przysłano nowego Proboszcza. Koniec 6 klasy podstawowej był… (koniec też etapu drugiego w mojej edukacji) egzamin też… zmiany…,0,1.0,2.0,0.0,1.0,0.0,41.0,0.024390243902439,0.048780487804878,0.0,1.0,0.0,0,0
5743,0,zajebałam się w pracy w stół wczoraj i mam guza który wygląda jak giga syf pzdr,-1,2.0,0.0,2.0,1.0,0.0,16.0,0.125,0.0,1.0,0.5,0.0,0,0
2857,0,"Patrząc na to, kto dostał MVP, to przyszłość należy do zawodników w loczkach",0,0.0,0.0,0.0,0.0,0.0,13.0,0.0,0.0,0.0,0.0,0.0,0,0
3701,0,HEHEHEHE,1,0.0,0.0,0.0,0.0,0.0,1.0,0.0,0.0,0.0,0.0,0.0,0,0
1902,1,Cały gang to raczej not,0,0.0,0.0,0.0,0.0,0.0,5.0,0.0,0.0,0.0,0.0,0.0,0,0
1789,1,Lokiec mi popekal,1,0.0,1.0,0.0,0.0,0.0,3.0,0.0,0.3333333333333333,0.0,0.0,0.0,0,0
2256,0,"Wydam 300 złotych, tylko wskaż gdzie go mogę za tyle kupić, proszę.",1,3.0,0.0,3.0,0.0,0.0,12.0,0.25,0.0,1.0,0.0,0.0,0,0
2449,0,Facet cierpiał za miliony.:see-no-evil_monkey:,-1,0.0,0.0,0.0,0.0,0.0,4.0,0.0,0.0,0.0,0.0,0.0,1,0
5465,0,zrób wyjebe typu refund,0,0.0,0.0,0.0,0.0,0.0,4.0,0.0,0.0,0.0,0.0,0.0,0,0
5420,0,Tak tak tak tak! Chciałabym żeby tak było wszędzie,1,1.0,0.0,1.0,0.0,1.0,9.0,0.1111111111111111,0.0,1.0,0.0,1.0,0,0
4308,0,"dzień dobry,zrobiłam kłódę, zapraszam wszystkich fajnych ludzi ",1,1.0,0.0,1.0,0.0,0.0,8.0,0.125,0.0,1.0,0.0,0.0,0,0
1294,1,Keep anatomia away from me nie po to uciekalam z pielegniarstwa,0,1.0,1.0,1.0,1.0,0.0,11.0,0.0909090909090909,0.0909090909090909,1.0,1.0,0.0,0,0
3583,0,"ja Was bardzo przepraszam, ale smiechlam w glos...
znam ten szpital DOSKONALE 
to prywatny, jedyny jaki mamy na poludniu
z umowa z naszym NFZ
Hospiten Sur, 
tak zwana ""clinica verde""
Dno dna! 
ten sam w ktorym mnie 2 razy prawie załatwili...

tam Boga widzi każdy!
:rolling_on_the_floor_laughing::rolling_on_the_floor_laughing:",0,3.0,3.0,2.0,0.0,0.0,45.0,0.0666666666666666,0.0666666666666666,0.6666666666666666,0.0,0.0,1,1
2218,0,moje życie już nigdy nie będzie takie jak wtedy gdy to wyszło,-1,0.0,1.0,0.0,0.0,0.0,12.0,0.0,0.0833333333333333,0.0,0.0,0.0,0,1
1838,1,"""Jestem w drodze do nich"" napisał max 19-latek na garnuszku rodziców po pierwszej kasie za umowę-zlecenie :grinning_face_with_sweat::rolling_on_the_floor_laughing::face_with_tears_of_joy:",0,1.0,0.0,1.0,0.0,0.0,16.0,0.0625,0.0,1.0,0.0,0.0,1,1
5036,0,Dzień dobry w piąteczek :smiling_face_with_hearts: weeekeeeeend!!!!,1,0.0,0.0,0.0,0.0,0.0,5.0,0.0,0.0,0.0,0.0,0.0,1,0
4585,0,Polecam tego pysznego skurwola,1,1.0,0.0,1.0,0.0,0.0,4.0,0.25,0.0,1.0,0.0,0.0,0,0
217,1,"Był to trzeci etap - gimnazjum. Tam bardzo dobrze wspominam panią polonistkę - zasad pisowni się nie nauczyłam, ale lektury czytałam wszystkie, pisałam bardzo dobre wypracowania, zapewne z powodu zadawanych ciekawych tematów, wzorowo w opinii pani recytowałam wiersze…",1,5.0,0.0,5.0,4.0,0.0,36.0,0.1388888888888889,0.0,1.0,0.8,0.0,0,1
3444,0,życie nas nas,-1,0.0,2.0,0.0,0.0,0.0,3.0,0.0,0.6666666666666666,0.0,0.0,0.0,0,0
5435,0,"Czy nie mam urlopu? 
Tak.
Czy nie mam pieniędzy? 
Tak.
Czy bede probowala kupic bilety na koncert w Busan?
T A K",0,3.0,0.0,3.0,0.0,0.0,22.0,0.1363636363636363,0.0,1.0,0.0,0.0,0,0
2251,0,"Można np. z wyznaczonymi etapami, fazami, celami. Chyba zaplanowane cele będą tu najlepszym odpowiednikiem.",1,0.0,0.0,0.0,0.0,0.0,14.0,0.0,0.0,0.0,0.0,0.0,0,0
4133,0,dobrze ze jednak nie zdecydowalam sie na studiowanie politologii bo prawdopodobnie pojebalo by mnie nawet bardziej niz na aktualnym kierunku,-1,1.0,1.0,1.0,1.0,0.0,20.0,0.05,0.05,1.0,1.0,0.0,0,0
1823,1,"Nie przesadzajcie z tymi prezentami, bo nie jesteście jedyni. Po 30-40 latach nauczyciele już nie wiedzą, gdzie mają to wszystko trzymać.",-1,0.0,0.0,0.0,0.0,0.0,21.0,0.0,0.0,0.0,0.0,0.0,0,1
2740,0,"Ty sobie coś wkręciłeś Eryk, wiesz wgl skąd bierze się zmienność?",0,0.0,0.0,0.0,0.0,0.0,11.0,0.0,0.0,0.0,0.0,0.0,0,0
4105,0,"boze co messenger wymysla z tymi kodami dostepu do wiadomosci, bruh jak mi sie ktos wlamie i zacznie czytac o czym pisze to sam bedzie chcial sie skasowac z zycia",-1,1.0,1.0,1.0,1.0,0.0,30.0,0.0333333333333333,0.0333333333333333,1.0,1.0,0.0,0,0
3423,0,Nasze elity :grinning_face_with_sweat::exploding_head:,0,0.0,1.0,0.0,0.0,0.0,2.0,0.0,0.5,0.0,0.0,0.0,1,0
3816,0,"Zapowiada się kolejny tydzień przeładowany pracą, ale jakoś to będzie",0,0.0,0.0,0.0,0.0,0.0,10.0,0.0,0.0,0.0,0.0,0.0,0,0
437,1,Paweł długo nie pocieszył się cieplymi kapciami. Czy było warto? :melting_face: hotelparadise,-1,0.0,0.0,0.0,0.0,0.0,11.0,0.0,0.0,0.0,0.0,0.0,1,0
2642,0,"ja, kiedy chcę dokupić kolejne rzeczy do debiutu xD",0,1.0,1.0,1.0,0.0,0.0,9.0,0.1111111111111111,0.1111111111111111,1.0,0.0,0.0,1,0
5491,0,Mam taką warstwę podkładu na twarzy że hit,-1,1.0,0.0,1.0,0.0,0.0,8.0,0.125,0.0,1.0,0.0,0.0,0,0
1475,1,"Ja długo tak miałam przez zaburzenia które posiadam, ale zaczęłam nad tym pracować, bo to chujowe w stosunku do innych, a choroby nie są niczyim wytłumaczeniem. 
(nie mówię że autor się tak tłumaczy, pisze ogólnie)",-1,4.0,1.0,4.0,2.0,0.0,35.0,0.1142857142857142,0.0285714285714285,1.0,0.5,0.0,0,1
3989,0,nowe zdjęcia z peek a boo w roku pańskim dwa tysiące dwudziestym szóstym :loudly_crying_face: pan Han Jongchul zrobił to dla mnie,1,0.0,1.0,0.0,0.0,0.0,20.0,0.0,0.05,0.0,0.0,0.0,1,0
1273,1,"moj chlopak mowi, ze przejmuje sie jego psem jak wlasnym. poczekajcie, ja go ukradne... znaczy, pozycze na zawsze",1,1.0,2.0,1.0,0.0,0.0,18.0,0.0555555555555555,0.1111111111111111,1.0,0.0,0.0,0,1
1991,1,Dostaje nerwicy jak oglądam ten mecz,-1,1.0,0.0,1.0,0.0,0.0,6.0,0.1666666666666666,0.0,1.0,0.0,0.0,0,0
4079,0,"Drużyna zielona to rodzina mojego szwagra XD
awanturaokasę",0,0.0,1.0,0.0,0.0,0.0,8.0,0.0,0.125,0.0,0.0,0.0,1,0
3369,0,"Niechby się świat zawalił, to szmaty Epsteina muszą za to spłonąć na stosach żywcem. Obojętnie jakie stanowiska piastują - czy to prezydent Stanów Zjednoczonych czy gwiazda Hollywood, te kurwy muszą spłonąć na stosach. Nie ma litości dla szmat, krzywdzących dzieci.",-1,0.0,0.0,0.0,0.0,0.0,39.0,0.0,0.0,0.0,0.0,0.0,0,1
2089,1,"Zawsze byłam wrażliwcem, ale myślałam, że zawsze dam radę. Teraz nie dałam. Nie myślałam o sobie. Zawsze inni byli ważniejsi. Tak. Mam zdiagnozowaną depresję. Podjęłam leczenie i walkę o siebie. Musiałam to napisać.",-1,8.0,0.0,8.0,6.0,0.0,33.0,0.2424242424242424,0.0,1.0,0.75,0.0,0,1
2253,0,"""wrzucając butelki/puszki do maszyny, maszyna wie..."". To maszyna wrzuca butelki ? Maszyny zbierają, przynoszą, wrzucają.... Aha",0,0.0,0.0,0.0,0.0,0.0,15.0,0.0,0.0,0.0,0.0,0.0,0,0
4553,0,Gratulacje :smiling_face_with_heart-eyes:,1,0.0,0.0,0.0,0.0,0.0,1.0,0.0,0.0,0.0,0.0,0.0,1,0
2985,0,"Gej: pisze o czymś.
Prawicowcy:",0,0.0,0.0,0.0,0.0,0.0,5.0,0.0,0.0,0.0,0.0,0.0,0,0
3266,0,"To jak w polskim przekładzie filmów, gdzie ""Get the fuck out of here"" tłumaczą jako ""Odejdxź stąd, do diaska""  :winking_face:",-1,0.0,0.0,0.0,0.0,0.0,19.0,0.0,0.0,0.0,0.0,0.0,1,0
5410,0,"Omg tak jak rzadko wchodzę na fb tak teraz weszlam żeby coś babci sprawdzić i trzy posty pod rząd Pylatkowski, Irena Brodzińska, Tiger bonzo, co za combo… masakra, niech im ziemia lekką będzie, tak jak i wszystkim zmarłym",-1,2.0,0.0,2.0,1.0,0.0,38.0,0.0526315789473684,0.0,1.0,0.5,0.0,0,0
5568,0,"Wy chyba nie oglądaliście całego występu bo cały czas się sracie o max 30 minut nostalgicznego momentu puszczania piosenek na yt, a to że śpiewał pełno swoich nowych piosenek do których też ludzie śpiewali i się bawili to już nie widzicie XD on zrobił show w SWOIM stylu",1,0.0,0.0,0.0,0.0,0.0,48.0,0.0,0.0,0.0,0.0,0.0,1,1
634,1,wracam tu,1,1.0,0.0,1.0,0.0,0.0,2.0,0.5,0.0,1.0,0.0,0.0,0,0
5065,0,"Pete Hegseth zaczął się modlić tekstem moditwy z Pulp Fiction, wymyślonej przez Tarantino. 

Tej administracji nie da się sparodiować, bo czego byś nie wymyślił, to zrobią coś głupszego.",-1,0.0,0.0,0.0,0.0,0.0,28.0,0.0,0.0,0.0,0.0,0.0,0,0
5530,0,she is soooooo cool,1,0.0,0.0,0.0,0.0,0.0,4.0,0.0,0.0,0.0,0.0,0.0,0,0
2753,0,Ci co mają konta na bybit com przed wejściem bybit eu nadal mogą na luzie korzystać z dźwigni,0,1.0,0.0,1.0,1.0,0.0,18.0,0.0555555555555555,0.0,1.0,1.0,0.0,0,0
958,1,"Jezus te dwa pierwsze...... Przesada, przegięcie, za dobre",1,0.0,0.0,0.0,0.0,0.0,8.0,0.0,0.0,0.0,0.0,0.0,0,0
1381,1,"Chyba nie idę do szkoły, nie dam rady",-1,2.0,0.0,2.0,0.0,0.0,8.0,0.25,0.0,1.0,0.0,0.0,0,0
4243,0,"W nawiązaniu do publikacji i oskarżeń, które pojawiły się po ostatnim evencie Influo, odnoszę się do tej sprawy jeden raz. W przestrzeni publicznej padają słowa o „napadzie” i „kradzieży”, kierowane pod moim adresem oraz pod adresem agencji ochrony. To nieprawda.

Nie będę wymieniał nazwiska tej osoby. Nie zamierzam dokładać jej dodatkowej atencji.

Był uczestnikiem wydarzenia organizowanego przez Influo. Początkowo bawił się normalnie, jednak z czasem jego zachowanie zaczęło budzić niepokój wśród gości i organizatorów. Ochrona zgłosiła mi, że jest wulgarny, ubliża innym uczestnikom i eskaluje napięcie.

Poprosiłem, aby opuścił dom. Równolegle decyzję o wyprowadzeniu podjęła również ochrona po zgłoszeniach od uczestników. Zaczął się awanturować i stawiał opór przy opuszczaniu terenu wydarzenia.

Po wyprowadzeniu stał pod bramą, blokował uBery i zawracał kierowców. Według relacji świadków doszło również do naruszenia nietykalności dwóch osób. Te osoby złożyły zawiadomienia na policji.

Na miejsce została wezwana policja oraz karetka. Funkcjonariusze przyjęli zawiadomienia, zabezpieczyli materiał dowodowy i podjęli czynności. Został zatrzymany. Po przyjeździe zespołu ratownictwa medycznego odmówił wykonania obdukcji.

Nie było żadnej kradzieży. Nie było żadnego napadu. Nie wiem co się stało z jego rzeczami. To próba zbudowania medialnej narracji na jednostronnej wersji wydarzeń. Zabezpieczony materiał, którym dysponujemy, został przekazany policji.

To wszystko z mojej strony. Sprawą zajmują się moja kancelaria oraz organy ścigania.",-1,6.0,4.0,5.0,1.0,0.0,208.0,0.0288461538461538,0.0192307692307692,0.8333333333333334,0.1666666666666666,0.0,0,1
5195,0,"kto jest najgrozniejszym hakerem?
batman pl, fredi.exe czy benjamin znany pod pseudonimem BENIO. ja stawiam pieniadze na benia bo sk*rwysyn ma leb do komputerow.",-1,1.0,1.0,1.0,0.0,0.0,24.0,0.0416666666666666,0.0416666666666666,1.0,0.0,0.0,0,0
68,1,XD ja kiedyś wykituję z tymi anorektyczkami,1,1.0,1.0,1.0,0.0,0.0,7.0,0.1428571428571428,0.1428571428571428,1.0,0.0,0.0,1,0
1218,1,czytam flowers from 1970 jeszcze raz,1,1.0,0.0,1.0,0.0,0.0,6.0,0.1666666666666666,0.0,1.0,0.0,0.0,0,0
2047,1,"Moja matka nie może pojąć, że choruje na depresję. Mimo, że psychiatra z terapeutka walczą bym się nie zajebalam i nie trafiła znów na oddział psychiatryczny. Jedyne osoby, które są ze mnie dumne to terapeutka, psychiatra i moje przyjaciółki. Oni widzą tylko to, że nic nie robię",-1,3.0,3.0,3.0,1.0,1.0,47.0,0.0638297872340425,0.0638297872340425,1.0,0.3333333333333333,0.3333333333333333,0,1
4620,0,Ja się cieszę bardzo ze wszystkiego,1,1.0,1.0,1.0,0.0,0.0,6.0,0.1666666666666666,0.1666666666666666,1.0,0.0,0.0,0,1
3867,0,Może zajęci są spędzaniem miło czasu z rodzinką zamiast sraniem na twitterku,1,0.0,0.0,0.0,0.0,0.0,12.0,0.0,0.0,0.0,0.0,0.0,0,0
2438,0,"Telefon rozładowany, brak skarpety, obśliniona buzia, łeb boli, czujesz sie gorzej niż przed. Więcej wad niż zalet ale przynajmniej są ciekawe sny",0,0.0,0.0,0.0,0.0,0.0,22.0,0.0,0.0,0.0,0.0,0.0,0,0
4034,0,pojebało mnie i zaczęłam grabić na podwórku,-1,1.0,1.0,1.0,1.0,0.0,7.0,0.1428571428571428,0.1428571428571428,1.0,1.0,0.0,0,0
